{
  "$schema": "https://zarguell.github.io/eoltracker/v1/schema/product.json",
  "id": "datadirect-apache-impala-odbc",
  "name": "Apache Impala ODBC",
  "category": "software",
  "upstream_category": "app",
  "identifiers": [],
  "labels": {
    "ga": "Latest Release Date",
    "category": "Enterprise Essentials"
  },
  "links": {
    "html": "https://docs.progress.com/bundle/datadirect-product-life-cycle/page/topics/datadirect_life_cycle/datadirect-product-life-cycle.html",
    "life cycle policy": "https://docs-be.progress.com/bundle/datadirect-pdfs/raw/resource/enus/datadirect-life-cycle-policy.pdf",
    "discontinued products notice": "https://www.progress.com/docs/default-source/datadirect/progress-datadirect-dis-products-eol---faq_final-02-20-24.pdf"
  },
  "releases": [
    {
      "id": "07.16.0634",
      "name": "07.16.0634",
      "milestones": {
        "ga": "2026-05-11",
        "eos": null,
        "eossec": null,
        "eol": null
      },
      "upstream": {
        "name": "07.16.0634",
        "cells": {
          "ACTIVE Latest Release": "07.16.0634",
          "ACTIVE Latest Release Date": "11-May-26"
        },
        "table": "current release streams",
        "stream": "ACTIVE Release Stream"
      }
    }
  ],
  "provenance": {
    "source_url": "https://docs.progress.com/bundle/datadirect-product-life-cycle/page/topics/datadirect_life_cycle/datadirect-product-life-cycle.html",
    "verifier": "deterministic-progress-datadirect",
    "last_checked": "2026-09-26T22:23:44Z",
    "upstream_modified": null
  }
}
