{
  "$schema": "https://zarguell.github.io/eoltracker/v1/schema/product.json",
  "id": "vuetify",
  "name": "Vuetify",
  "category": "software",
  "upstream_category": "framework",
  "identifiers": [
    {
      "type": "purl",
      "id": "pkg:npm/vuetify"
    },
    {
      "type": "cpe",
      "id": "cpe:2.3:a:vuetifyjs:vuetify"
    },
    {
      "type": "cpe",
      "id": "cpe:/a:vuetifyjs:vuetify"
    }
  ],
  "labels": {
    "eoas": "Active Support",
    "discontinued": null,
    "eol": "Security Support",
    "eoes": "Commercial Support"
  },
  "links": {
    "icon": "https://cdn.jsdelivr.net/npm/simple-icons/icons/vuetify.svg",
    "html": "https://endoflife.date/vuetify",
    "releasePolicy": "https://vuetifyjs.com/introduction/long-term-support/"
  },
  "releases": [
    {
      "id": "4",
      "name": "4",
      "milestones": {
        "ga": "2026-02-23",
        "eos": null,
        "eossec": null,
        "eol": null
      },
      "upstream": {
        "name": "4",
        "codename": null,
        "label": "4",
        "releaseDate": "2026-02-23",
        "isLts": false,
        "ltsFrom": null,
        "isEoas": false,
        "eoasFrom": null,
        "isEol": false,
        "eolFrom": null,
        "isEoes": null,
        "eoesFrom": null,
        "isMaintained": true,
        "latest": {
          "name": "4.2.1",
          "date": "2026-09-09",
          "link": "https://github.com/vuetifyjs/vuetify/releases/tag/v4.2.1"
        },
        "custom": null
      }
    },
    {
      "id": "3",
      "name": "3",
      "milestones": {
        "ga": "2022-11-01",
        "eos": null,
        "eossec": "2027-07-27",
        "eol": null
      },
      "upstream": {
        "name": "3",
        "codename": null,
        "label": "3",
        "releaseDate": "2022-11-01",
        "isLts": false,
        "ltsFrom": null,
        "isEoas": true,
        "eoasFrom": "2026-07-27",
        "isEol": false,
        "eolFrom": "2027-07-27",
        "isEoes": null,
        "eoesFrom": null,
        "isMaintained": true,
        "latest": {
          "name": "3.13.4",
          "date": "2026-09-09",
          "link": "https://github.com/vuetifyjs/vuetify/releases/tag/v3.13.4"
        },
        "custom": null
      }
    },
    {
      "id": "2",
      "name": "2",
      "milestones": {
        "ga": "2019-07-23",
        "eos": null,
        "eossec": "2025-01-23",
        "eol": null
      },
      "upstream": {
        "name": "2",
        "codename": null,
        "label": "2",
        "releaseDate": "2019-07-23",
        "isLts": false,
        "ltsFrom": null,
        "isEoas": true,
        "eoasFrom": "2023-07-05",
        "isEol": true,
        "eolFrom": "2025-01-23",
        "isEoes": false,
        "eoesFrom": null,
        "isMaintained": true,
        "latest": {
          "name": "2.7.2",
          "date": "2024-02-14",
          "link": "https://github.com/vuetifyjs/vuetify/releases/tag/v2.7.2"
        },
        "custom": null
      }
    },
    {
      "id": "1",
      "name": "1 (LTS)",
      "milestones": {
        "ga": "2019-02-05",
        "eos": null,
        "eossec": "2020-07-31",
        "eol": null
      },
      "upstream": {
        "name": "1",
        "codename": null,
        "label": "1 (LTS)",
        "releaseDate": "2019-02-05",
        "isLts": true,
        "ltsFrom": "2019-07-31",
        "isEoas": true,
        "eoasFrom": "2019-07-31",
        "isEol": true,
        "eolFrom": "2020-07-31",
        "isEoes": null,
        "eoesFrom": null,
        "isMaintained": false,
        "latest": {
          "name": "1.5.24",
          "date": "2020-03-03",
          "link": "https://github.com/vuetifyjs/vuetify/releases/tag/v1.5.24"
        },
        "custom": null
      }
    }
  ],
  "provenance": {
    "source_url": "https://endoflife.date/api/v1/products/vuetify/",
    "verifier": "deterministic-endoflife-date-v1",
    "last_checked": "2026-09-17T11:51:01Z",
    "upstream_modified": "2026-09-10T00:08:43+00:00"
  }
}
